{
  "$schema": "http://json-schema.org/draft-07/schema#",
  "title": "OC World Record",
  "type": "object",
  "required": [
    "uid",
    "category",
    "achieved_at",
    "value_mhz",
    "hardware",
    "overclockers",
    "sources",
    "tags",
    "verified"
  ],
  "properties": {
    "uid": {
      "type": "string",
      "pattern": "^[0-9]{8}_[0-9]+(\\.[0-9]+)?(_[0-9]{2})?$",
      "description": "Unique identifier: YYYYMMDD_valueMHz (integer part only). Collision suffix _01, _02 etc. appended by tooling when needed."
    },
    "category": {
      "type": "string",
      "enum": ["cpu", "gpu", "memory"]
    },
    "subcategory": {
      "type": "array",
      "items": {
        "type": "string"
      },
      "description": "Curated sub-timelines this record belongs to (e.g. ['dgpu', 'amd-dgpu'])"
    },
    "achieved_at": {
      "type": "string",
      "format": "date",
      "pattern": "^[0-9]{4}-(0[1-9]|1[0-2])-(0[1-9]|[12][0-9]|3[01])$",
      "description": "ISO 8601 date: YYYY-MM-DD"
    },
    "achieved_at_approximate": {
      "type": "boolean",
      "description": "true if only month/year is known, not the exact day"
    },
    "value_mhz": {
      "type": "number",
      "exclusiveMinimum": 0
    },
    "hardware": {
      "type": "object",
      "required": ["primary"],
      "properties": {
        "primary": {
          "type": ["string", "null"],
          "description": "The overclocked component, e.g. Intel Core i9-14900KF"
        },
        "motherboard": {
          "type": ["string", "null"]
        },
        "memory": {
          "type": ["string", "null"]
        },
        "cooling": {
          "type": ["string", "null"]
        }
      },
      "additionalProperties": false
    },
    "overclockers": {
      "type": "array",
      "minItems": 1,
      "items": {
        "type": "object",
        "required": ["handle"],
        "properties": {
          "handle": {
            "type": "string",
            "minLength": 1,
            "description": "Required non-null, non-empty username/handle"
          },
          "real_name": {
            "type": ["string", "null"]
          },
          "aliases": {
            "type": "array",
            "items": {
              "type": "string"
            }
          },
          "country": {
            "type": ["string", "null"],
            "pattern": "^[A-Z]{2}$",
            "description": "ISO 3166-1 alpha-2 uppercase, e.g. 'US', 'TW', 'DE'"
          },
          "profile_url": {
            "type": ["string", "null"]
          }
        },
        "additionalProperties": false
      }
    },
    "sources": {
      "type": "array",
      "description": "List of sources for this record (can be empty while data is being added)",
      "items": {
        "type": "object",
        "required": ["label", "url"],
        "properties": {
          "label": {
            "type": "string",
            "minLength": 1
          },
          "url": {
            "type": ["string", "null"]
          },
          "archived_url": {
            "type": ["string", "null"]
          }
        },
        "additionalProperties": false
      }
    },
    "assets": {
      "type": "array",
      "items": {
        "type": "object",
        "required": ["file", "type"],
        "properties": {
          "file": {
            "type": "string",
            "minLength": 1
          },
          "type": {
            "type": "string",
            "enum": ["cpuz", "gpuz", "validation", "photo", "other"]
          },
          "caption": {
            "type": ["string", "null"]
          }
        },
        "additionalProperties": false
      }
    },
    "tags": {
      "type": "array",
      "items": {
        "type": "string"
      }
    },
    "notes": {
      "type": ["string", "null"]
    },
    "verified": {
      "type": "boolean"
    },
    "submitted_by": {
      "type": ["string", "null"]
    },
    "hero": {
      "type": ["string", "null"],
      "description": "Filename of the hero image shown in the detail panel"
    },
    "not_a_record": {
      "type": "boolean",
      "description": "Set to true to manually exclude this entry from the timeline. Add explanation in notes."
    }
  },
  "additionalProperties": false
}