{
  "uid": "20110113_2000",
  "category": "gpu",
  "subcategory": [
    "igp-cpu"
  ],
  "achieved_at": "2011-01-13",
  "achieved_at_approximate": false,
  "value_mhz": 2000,
  "hardware": {
    "primary": "Intel HD Graphics 3000 (Sandy Bridge)",
    "motherboard": "ASUS P8H67-M Evo",
    "memory": null,
    "cooling": "Single Stage"
  },
  "hero": "2000.jpg",
  "not_a_record": false,
  "overclockers": [
    {
      "handle": "Stummerwinter",
      "real_name": null,
      "aliases": [],
      "country": "DE",
      "profile_url": null
    }
  ],
  "sources": [
    {
      "label": "HWBOT",
      "url": "https://hwbot.org/submission/2105637_",
      "archived_url": null
    }
  ],
  "assets": [
    {
      "file": "2000.jpg",
      "type": "other",
      "caption": null
    },
    {
      "file": "2000_hwbot.png",
      "type": "other",
      "caption": null
    },
    {
      "file": "image_id_512100.jpg",
      "type": "other",
      "caption": null
    },
    {
      "file": "image_id_512101.jpg",
      "type": "other",
      "caption": null
    }
  ],
  "tags": [
    "Intel"
  ],
  "notes": null,
  "verified": true,
  "submitted_by": "skatterbencher"
}