{
  "uid": "20241115_6263",
  "category": "memory",
  "subcategory": [
    "ddr5"
  ],
  "achieved_at": "2024-11-15",
  "achieved_at_approximate": false,
  "value_mhz": 6263.9,
  "hardware": {
    "primary": "V-Color",
    "motherboard": null,
    "memory": null,
    "cooling": null
  },
  "overclockers": [
    {
      "handle": "AKM",
      "real_name": null,
      "aliases": [],
      "country": "US",
      "profile_url": null
    }
  ],
  "sources": [
    {
      "label": "CPU-Z",
      "url": "https://valid.x86.fr/1jpsje",
      "archived_url": null
    }
  ],
  "assets": [],
  "tags": [
    "DDR5"
  ],
  "notes": null,
  "verified": true,
  "submitted_by": "skatterbencher"
}
