{
  "uid": "20190516_2863",
  "category": "memory",
  "subcategory": [
    "ddr4"
  ],
  "achieved_at": "2019-05-16",
  "achieved_at_approximate": false,
  "value_mhz": 2863,
  "hardware": {
    "primary": "Crucial",
    "motherboard": "ASUS ROG Maximus XI Apex",
    "memory": null,
    "cooling": null
  },
  "hero": null,
  "not_a_record": false,
  "overclockers": [
    {
      "handle": "OGS",
      "real_name": null,
      "aliases": [],
      "country": "GR",
      "profile_url": null
    }
  ],
  "sources": [
    {
      "label": "CPU-Z",
      "url": "http://valid.x86.fr/cc42lc",
      "archived_url": null
    },
    {
      "label": "HWBOT",
      "url": "https://hwbot.org/benchmarks/memory_frequency/submissions/4156022",
      "archived_url": null
    }
  ],
  "assets": [],
  "tags": [
    "DDR4"
  ],
  "notes": null,
  "verified": true,
  "submitted_by": "skatterbencher"
}
