{
  "uid": "20020327_4010",
  "category": "cpu",
  "subcategory": [],
  "achieved_at": "2002-03-27",
  "achieved_at_approximate": false,
  "value_mhz": 4010.88,
  "hardware": {
    "primary": "Intel Pentium 4 2.4 GHz",
    "motherboard": "ABIT TH7II",
    "memory": null,
    "cooling": "Liquid Nitrogen"
  },
  "hero": "020327_01.gif",
  "not_a_record": false,
  "overclockers": [
    {
      "handle": "Holicho",
      "real_name": "ほりっちょ",
      "aliases": [],
      "country": "JP",
      "profile_url": null
    }
  ],
  "sources": [
    {
      "label": "Holicho",
      "url": "http://holicho.lib.net/bn_03.htm",
      "archived_url": null
    },
    {
      "label": "Muropaketti",
      "url": "http://www.muropaketti.com/arkisto/02/02_13.phtml",
      "archived_url": null
    }
  ],
  "assets": [
    {
      "file": "020327_01.gif",
      "type": "other",
      "caption": null
    },
    {
      "file": "020327_01.jpg",
      "type": "other",
      "caption": null
    },
    {
      "file": "020327_02.jpg",
      "type": "other",
      "caption": null
    },
    {
      "file": "020327_03.gif",
      "type": "other",
      "caption": null
    },
    {
      "file": "020327_04.gif",
      "type": "other",
      "caption": null
    },
    {
      "file": "020327_04.jpg",
      "type": "other",
      "caption": null
    },
    {
      "file": "020327_05.jpg",
      "type": "other",
      "caption": null
    },
    {
      "file": "020327_06.jpg",
      "type": "other",
      "caption": null
    },
    {
      "file": "020327_07.jpg",
      "type": "other",
      "caption": null
    },
    {
      "file": "020327_08.jpg",
      "type": "other",
      "caption": null
    },
    {
      "file": "020327_09.jpg",
      "type": "other",
      "caption": null
    },
    {
      "file": "020327_10.jpg",
      "type": "other",
      "caption": null
    },
    {
      "file": "020327_11.jpg",
      "type": "other",
      "caption": null
    },
    {
      "file": "4010.gif",
      "type": "other",
      "caption": null
    },
    {
      "file": "4010_holicho.png",
      "type": "other",
      "caption": null
    },
    {
      "file": "4010_muro.png",
      "type": "other",
      "caption": null
    }
  ],
  "tags": [
    "Intel"
  ],
  "notes": null,
  "verified": true,
  "submitted_by": "skatterbencher"
}