{
  "uid": "20121119_8794",
  "category": "cpu",
  "subcategory": [],
  "achieved_at": "2012-11-19",
  "achieved_at_approximate": false,
  "value_mhz": 8794.33,
  "hardware": {
    "primary": "AMD FX-8350",
    "motherboard": "ASUS CROSSHAIR V FORMULA-Z",
    "memory": null,
    "cooling": "Liquid Nitrogen"
  },
  "hero": "879433.png",
  "not_a_record": false,
  "overclockers": [
    {
      "handle": "AndreYang",
      "real_name": "Andre Yang",
      "aliases": [],
      "country": "TW",
      "profile_url": null
    }
  ],
  "sources": [
    {
      "label": "CPU-Z",
      "url": "http://valid.x86.fr/lpza4n",
      "archived_url": null
    }
  ],
  "assets": [
    {
      "file": "879433.png",
      "type": "other",
      "caption": null
    },
    {
      "file": "879433_cpuz.png",
      "type": "cpuz",
      "caption": null
    }
  ],
  "tags": [
    "AMD"
  ],
  "notes": null,
  "verified": true,
  "submitted_by": "skatterbencher"
}