{
  "uid": "20250509_4250",
  "category": "gpu",
  "subcategory": [
    "igp-cpu"
  ],
  "achieved_at": "2025-05-09",
  "achieved_at_approximate": false,
  "value_mhz": 4250,
  "hardware": {
    "primary": "Intel Graphics (Arrow Lake)",
    "motherboard": null,
    "memory": null,
    "cooling": "Liquid Nitrogen"
  },
  "hero": "4250.png",
  "not_a_record": false,
  "overclockers": [
    {
      "handle": "SkatterBencher",
      "real_name": "Pieter Plaisier",
      "aliases": [
        "Massman"
      ],
      "country": "BE",
      "profile_url": null
    }
  ],
  "sources": [
    {
      "label": "YouTube",
      "url": "https://www.youtube.com/watch?v=IwM-r2z3COQ",
      "archived_url": null
    }
  ],
  "assets": [
    {
      "file": "4250.png",
      "type": "other",
      "caption": null
    },
    {
      "file": "Screenshot (144).png",
      "type": "other",
      "caption": null
    }
  ],
  "tags": [
    "Intel"
  ],
  "notes": null,
  "verified": true,
  "submitted_by": "skatterbencher"
}