{
  "uid": "20230617_3930",
  "category": "gpu",
  "subcategory": [
    "dgpu"
  ],
  "achieved_at": "2023-06-17",
  "achieved_at_approximate": false,
  "value_mhz": 3930,
  "hardware": {
    "primary": "NVIDIA GeForce RTX 4090",
    "motherboard": null,
    "memory": null,
    "cooling": "Liquid Nitrogen"
  },
  "hero": "3930.png",
  "not_a_record": false,
  "overclockers": [
    {
      "handle": "CENS",
      "real_name": null,
      "aliases": [],
      "country": "DE",
      "profile_url": null
    }
  ],
  "sources": [
    {
      "label": "HWBOT",
      "url": "https://hwbot.org/benchmarks/gpupi_v3.3_-_32b/submissions/5295883",
      "archived_url": null
    }
  ],
  "assets": [
    {
      "file": "3930.png",
      "type": "other",
      "caption": null
    },
    {
      "file": "3930_hwbot.png",
      "type": "other",
      "caption": null
    },
    {
      "file": "image_id_2938714.jpg",
      "type": "other",
      "caption": null
    }
  ],
  "tags": [
    "NVDIA"
  ],
  "notes": null,
  "verified": true,
  "submitted_by": "skatterbencher"
}