{
  "uid": "20250517_6416",
  "category": "memory",
  "subcategory": [
    "ddr5"
  ],
  "achieved_at": "2025-05-17",
  "achieved_at_approximate": false,
  "value_mhz": 6416.3,
  "hardware": {
    "primary": "Corsair",
    "motherboard": null,
    "memory": null,
    "cooling": null
  },
  "overclockers": [
    {
      "handle": "Saltycroissant",
      "real_name": null,
      "aliases": [],
      "country": "CA",
      "profile_url": null
    }
  ],
  "sources": [
    {
      "label": "CPU-Z",
      "url": "https://valid.x86.fr/5jqbgg",
      "archived_url": null
    }
  ],
  "assets": [],
  "tags": [
    "DDR5"
  ],
  "notes": null,
  "verified": true,
  "submitted_by": "skatterbencher"
}
