{
  "uid": "20061106_475",
  "category": "gpu",
  "subcategory": [
    "igp-chipset"
  ],
  "achieved_at": "2006-11-06",
  "achieved_at_approximate": false,
  "value_mhz": 475,
  "hardware": {
    "primary": "NVIDIA GeForce 6150",
    "motherboard": "A8N-VM CS",
    "memory": null,
    "cooling": null
  },
  "hero": null,
  "not_a_record": false,
  "overclockers": [
    {
      "handle": "Demiurg",
      "real_name": null,
      "aliases": [],
      "country": "RU",
      "profile_url": null
    }
  ],
  "sources": [
    {
      "label": "HWBOT",
      "url": "https://hwbot.org/submission/558309_",
      "archived_url": null
    },
    {
      "label": "Futuremark ORB",
      "url": "http://service.futuremark.com/compare?2k3=5062497",
      "archived_url": null
    }
  ],
  "assets": [
    {
      "file": "475_hwbot.png",
      "type": "other",
      "caption": null
    }
  ],
  "tags": [
    "NVIDIA"
  ],
  "notes": null,
  "verified": true,
  "submitted_by": "skatterbencher"
}