{
  "uid": "20041001_810",
  "category": "gpu",
  "subcategory": [
    "dgpu"
  ],
  "achieved_at": "2004-10-01",
  "achieved_at_approximate": false,
  "value_mhz": 810,
  "hardware": {
    "primary": "Ati Radeon X800 XT Platinum",
    "motherboard": null,
    "memory": null,
    "cooling": "Liquid Nitrogen"
  },
  "hero": null,
  "not_a_record": false,
  "overclockers": [
    {
      "handle": "Macci",
      "real_name": null,
      "aliases": [],
      "country": "FI",
      "profile_url": null
    }
  ],
  "sources": [
    {
      "label": "VR-Zone Forums",
      "url": "http://www.vrforums.com/showthread.php?t=17063",
      "archived_url": null
    }
  ],
  "assets": [],
  "tags": [
    "ATI"
  ],
  "notes": null,
  "verified": true,
  "submitted_by": "skatterbencher"
}