{
  "uid": "20000904_205",
  "category": "memory",
  "subcategory": [
    "sdr"
  ],
  "achieved_at": "2000-09-04",
  "achieved_at_approximate": false,
  "value_mhz": 205.86,
  "hardware": {
    "primary": null,
    "motherboard": null,
    "memory": null,
    "cooling": null
  },
  "hero": null,
  "not_a_record": false,
  "overclockers": [
    {
      "handle": "TAM",
      "real_name": null,
      "aliases": [],
      "country": "JP",
      "profile_url": null
    }
  ],
  "sources": [
    {
      "label": "Holicho WCPUID",
      "url": "http://holicho.lib.net/wcpuid/wcpuid.htm",
      "archived_url": null
    }
  ],
  "assets": [],
  "tags": [
    "SDR"
  ],
  "notes": null,
  "verified": false,
  "submitted_by": "skatterbencher"
}
