{
  "uid": "20071214_710",
  "category": "gpu",
  "subcategory": [
    "igp-chipset"
  ],
  "achieved_at": "2007-12-14",
  "achieved_at_approximate": false,
  "value_mhz": 710,
  "hardware": {
    "primary": "NVIDIA GeForce 7150",
    "motherboard": null,
    "memory": null,
    "cooling": null
  },
  "hero": null,
  "not_a_record": false,
  "overclockers": [
    {
      "handle": "Fr3ak",
      "real_name": null,
      "aliases": [],
      "country": "DE",
      "profile_url": null
    }
  ],
  "sources": [
    {
      "label": "HWBOT",
      "url": "https://hwbot.org/submission/676018_",
      "archived_url": null
    }
  ],
  "assets": [],
  "tags": [],
  "notes": null,
  "verified": true,
  "submitted_by": "skatterbencher"
}