{
  "uid": "20141001_2208",
  "category": "gpu",
  "subcategory": [
    "dgpu"
  ],
  "achieved_at": "2014-10-01",
  "achieved_at_approximate": false,
  "value_mhz": 2208.0,
  "hardware": {
    "primary": "NVIDIA GeForce GTX 980",
    "motherboard": null,
    "memory": null,
    "cooling": null
  },
  "overclockers": [
    {
      "handle": "Elmor",
      "real_name": null,
      "aliases": [],
      "country": null,
      "profile_url": null
    }
  ],
  "sources": [],
  "assets": [],
  "hero": null,
  "tags": [],
  "notes": null,
  "not_a_record": false,
  "verified": true,
  "submitted_by": "skatterbencher"
}