{
  "uid": "19980801_661",
  "category": "cpu",
  "subcategory": [],
  "achieved_at": "1998-08-01",
  "achieved_at_approximate": false,
  "value_mhz": 661.5,
  "hardware": {
    "primary": "Intel Pentium II 450 MHz",
    "motherboard": null,
    "memory": null,
    "cooling": null
  },
  "hero": null,
  "not_a_record": false,
  "overclockers": [
    {
      "handle": "RYK",
      "real_name": null,
      "aliases": [],
      "country": "JP",
      "profile_url": null
    }
  ],
  "sources": [
    {
      "label": "Nifty",
      "url": "http://www.nifty.ne.jp:80/forum/fextpup/fextpup1/spgp_02.htm",
      "archived_url": null
    }
  ],
  "assets": [],
  "tags": [
    "Intel"
  ],
  "notes": null,
  "verified": true,
  "submitted_by": "skatterbencher"
}