{
  "uid": "20120819_440",
  "category": "memory",
  "subcategory": [
    "ddr"
  ],
  "achieved_at": "2012-08-19",
  "achieved_at_approximate": false,
  "value_mhz": 440.5,
  "hardware": {
    "primary": "Team Group",
    "motherboard": null,
    "memory": null,
    "cooling": null
  },
  "overclockers": [
    {
      "handle": "I.nfraR.ed",
      "real_name": null,
      "aliases": [],
      "country": "BG",
      "profile_url": null
    }
  ],
  "sources": [
    {
      "label": "CPU-Z Validation",
      "url": "https://valid.x86.fr/show_oc.php?id=2482084",
      "archived_url": null
    }
  ],
  "assets": [],
  "hero": null,
  "tags": [
    "DDR"
  ],
  "notes": null,
  "not_a_record": false,
  "verified": true,
  "submitted_by": "skatterbencher"
}
