{
  "uid": "20230117_5612",
  "category": "memory",
  "subcategory": [
    "ddr5"
  ],
  "achieved_at": "2023-01-17",
  "achieved_at_approximate": false,
  "value_mhz": 5612.3,
  "hardware": {
    "primary": "GIGABYTE",
    "motherboard": null,
    "memory": null,
    "cooling": null
  },
  "overclockers": [
    {
      "handle": "HiCookie",
      "real_name": null,
      "aliases": [],
      "country": "TW",
      "profile_url": null
    }
  ],
  "sources": [
    {
      "label": "CPU-Z",
      "url": "https://valid.x86.fr/ne5inn",
      "archived_url": null
    }
  ],
  "assets": [],
  "tags": [
    "DDR5"
  ],
  "notes": null,
  "verified": true,
  "submitted_by": "skatterbencher"
}
