{
  "uid": "20081219_1346",
  "category": "memory",
  "subcategory": [
    "ddr3"
  ],
  "achieved_at": "2008-12-19",
  "achieved_at_approximate": false,
  "value_mhz": 1346.2,
  "hardware": {
    "primary": "Samsung",
    "motherboard": null,
    "memory": null,
    "cooling": null
  },
  "hero": null,
  "not_a_record": false,
  "overclockers": [
    {
      "handle": "Xenic",
      "real_name": null,
      "aliases": [],
      "country": null,
      "profile_url": null
    }
  ],
  "sources": [
    {
      "label": "CPU-Z",
      "url": "http://valid.canardpc.com:80/show_oc.php?id=465923",
      "archived_url": null
    }
  ],
  "assets": [],
  "tags": [
    "DDR3"
  ],
  "notes": null,
  "verified": true,
  "submitted_by": "skatterbencher"
}
