{
  "uid": "20110106_1950",
  "category": "gpu",
  "subcategory": [
    "igp-cpu"
  ],
  "achieved_at": "2011-01-06",
  "achieved_at_approximate": false,
  "value_mhz": 1950,
  "hardware": {
    "primary": "Intel HD Graphics 2000 (Sandy Bridge)",
    "motherboard": null,
    "memory": null,
    "cooling": "Liquid Nitrogen"
  },
  "hero": null,
  "not_a_record": false,
  "overclockers": [
    {
      "handle": "[Wanted]",
      "real_name": null,
      "aliases": [],
      "country": "RO",
      "profile_url": null
    }
  ],
  "sources": [
    {
      "label": "HWBOT",
      "url": "https://hwbot.org/submission/2101238_",
      "archived_url": null
    }
  ],
  "assets": [],
  "tags": [
    "Intel"
  ],
  "notes": null,
  "verified": true,
  "submitted_by": "skatterbencher"
}