{
  "uid": "20000819_210",
  "category": "memory",
  "subcategory": [
    "sdr"
  ],
  "achieved_at": "2000-08-19",
  "achieved_at_approximate": false,
  "value_mhz": 210.05,
  "hardware": {
    "primary": "MT-7E 128MB",
    "motherboard": "BH6v1.2+TurboPLL",
    "memory": "MT-7E 128MB",
    "cooling": "Subzero"
  },
  "hero": "21005.gif",
  "overclockers": [
    {
      "handle": "Holicho",
      "real_name": "ほりっちょ",
      "aliases": [],
      "country": "JP",
      "profile_url": null
    }
  ],
  "sources": [
    {
      "label": "Holicho WCPUID",
      "url": "http://holicho.lib.net/wcpuid/wcpuid.htm",
      "archived_url": null
    },
    {
      "label": "Blog",
      "url": "http://holicho.lib.net/bench/my_wcpuid.htm",
      "archived_url": null
    }
  ],
  "assets": [
    {
      "file": "21005.gif",
      "type": "other",
      "caption": null
    },
    {
      "file": "21005_holicho.png",
      "type": "other",
      "caption": null
    },
    {
      "file": "21005_blog.png",
      "type": "other",
      "caption": null
    }
  ],
  "tags": [
    "SDR"
  ],
  "notes": null,
  "verified": true,
  "submitted_by": "skatterbencher"
}
