{
  "uid": "20120831_1937",
  "category": "memory",
  "subcategory": [
    "ddr3"
  ],
  "achieved_at": "2012-08-31",
  "achieved_at_approximate": false,
  "value_mhz": 1937.9,
  "hardware": {
    "primary": "Avexir",
    "motherboard": null,
    "memory": null,
    "cooling": null
  },
  "hero": null,
  "not_a_record": false,
  "overclockers": [
    {
      "handle": "Christian Ney",
      "real_name": null,
      "aliases": [],
      "country": "CH",
      "profile_url": null
    }
  ],
  "sources": [
    {
      "label": "CPU-Z",
      "url": "http://valid.canardpc.com/show_oc.php?id=2494101",
      "archived_url": null
    },
    {
      "label": "HWBOT",
      "url": "https://hwbot.org/benchmarks/memory_frequency/submissions/2310359",
      "archived_url": null
    }
  ],
  "assets": [],
  "tags": [
    "DDR3"
  ],
  "notes": null,
  "verified": true,
  "submitted_by": "skatterbencher"
}
