{
  "uid": "20060611_1045",
  "category": "gpu",
  "subcategory": [
    "dgpu"
  ],
  "achieved_at": "2006-06-11",
  "achieved_at_approximate": false,
  "value_mhz": 1045,
  "hardware": {
    "primary": "NVIDIA GeForce 7900 GTX",
    "motherboard": "Foxconn C51XEM2AA",
    "memory": null,
    "cooling": "Liquid Nitrogen"
  },
  "hero": "1045_2.png",
  "not_a_record": true,
  "overclockers": [
    {
      "handle": "K|ngp|n",
      "real_name": "Vince Lucido",
      "aliases": [],
      "country": "US",
      "profile_url": null
    }
  ],
  "sources": [
    {
      "label": "HWBOT",
      "url": "https://hwbot.org/submission/3048776_",
      "archived_url": null
    },
    {
      "label": "Futuremark ORB",
      "url": "http://service.futuremark.com/compare?2k3=4826982",
      "archived_url": null
    },
    {
      "label": "Futuremark HOF",
      "url": "http://futuremark.com/community/halloffame/",
      "archived_url": null
    }
  ],
  "assets": [
    {
      "file": "1045.png",
      "type": "other",
      "caption": null
    },
    {
      "file": "1045_2.png",
      "type": "other",
      "caption": null
    },
    {
      "file": "1045_hof.png",
      "type": "other",
      "caption": null
    },
    {
      "file": "1045_hwbot.png",
      "type": "other",
      "caption": null
    },
    {
      "file": "1045_orb2.png",
      "type": "other",
      "caption": null
    }
  ],
  "tags": [
    "NVIDIA"
  ],
  "notes": null,
  "verified": true,
  "submitted_by": "skatterbencher"
}